{
  "contract": "market.dataset/v1",
  "id": "dsv_00000000000000000000000001",
  "name": "basmati_punjab_2021-2026 (release 1)",
  "rows": 6678,
  "dated_rows": 6098,
  "blank_date_rows": 580,
  "flagged_rows": 8,
  "validation_status": "PENDING_HAND_CHECK",
  "manifest_sha256": "aaaaaaaaaaaaaaaaaaaaaaaaaaaaaaaaaaaaaaaaaaaaaaaaaaaaaaaaaaaaaaaa",
  "imported_at": "2026-10-26T10:00:00.000Z",
  "note": "blank-date rule not yet confirmed on the website"
}
